id,tweet,class
1698,unit unit best way unit one true love shop usa fashion capit newyork unitedvusa,positive
1699,delta jetblu yes yes great trip thank lift,positive
1700,delta jetblu let know status flight pbi jfk delay hour board problem hatch,negative
1701,unit unit okay thank help,positive
1702,american americanair thought plane retir,neutral
1703,unit unit help appreci looong wait help someth fault,negative
1704,delta jetblu airway stock rate lower vetr inc jblu dakota financi news,neutral
1705,unit unit belabor point abl put laptop bag seat announc leav roller thx,negative
1706,southwest southwestair rapid reward program sold short lasttweetaboutthi still disappoint,negative
1707,unit unit also unit phone repres ask web password normal,neutral
1708,american americanair frustrat paid get refund,negative
1709,airway usairway usairway unaccept holdtim realli,negative
1710,southwest southwestair would etern grate ticket vega show god bless,neutral
1711,unit unit time call custom servic least min time cut oper call back,negative
1712,southwest southwestair thank follow glad get bag back,positive
1713,airway usairway loos lot busi use barclay cant believ cant appli card live iowa,negative
1714,airway usairway follow,neutral
1715,southwest southwestair promis unfollow,neutral
1716,american americanair flight prepar flight flytpa depart flyohar,neutral
1717,unit unit thank much miss bag nonexist staff appar remot outpost busi airport citi,negative
1718,unit unit happen everi time newark,neutral
1719,southwest southwestair haha thank explan,positive
1720,american americanair know may also work home thank noth,negative
1721,airway usairway alreadi pleasant flight london charlott made fantast amaz attend thank much robert,positive
1722,unit unit avail onlin figur guarante flight,neutral
1723,airway usairway got phone usair cancel flightl return flight miss flight way took care,neutral
1724,southwest southwestair thank thank thank,positive
1725,american americanair pleas bring american airlin blackberri,neutral
1726,delta jetblu dominican republ number,neutral
1727,unit unit crew lack lot custom servic lax employe lot better wonder,negative
1728,southwest southwestair big thank team famili emerg day ticket experi excel time fli yall last,positive
1729,southwest southwestair sent,neutral
1730,unit unit fill form sent link either,neutral
1731,airway usairway yes februari bad weather happen everi winter guy busi sens forecast loss,negative
1732,airway usairway fli manchest intern philadelphia get email delay inform connect flight,negative
1733,american americanair thank yayayay,positive
1734,southwest southwestair class would luv know charg twitter mani peopl write tweet gracia,neutral
1735,american americanair may keep lose bag info longer trust bad way handl,negative
1736,american americanair cancel flightl get two day explan,negative
1737,delta jetblu run tweeter use word fleek,neutral
1738,virgin america virginamerica sound like fun,positive
1739,unit unit confirm mean,neutral
1740,delta jetblu thank instant repli still first bag free import,positive
1741,southwest southwestair idea spring sale soon travel late flight august earli septemb go lax,neutral
1742,unit unit pleas see,neutral
1743,airway usairway worst airlin ive ever flown guy treat like garbag today,negative
1744,american americanair get cinci luggag still tonight strand dalla day cloth yousuck,negative
1745,virgin america virginamerica thank easi itinerari shift impend weather quick painless amp free,positive
1746,delta jetblu beauti ride thank,positive
1747,unit unit thank,positive
1748,southwest southwestair salt honey roast vote bring back salt peanut dread year honey roast,neutral
1749,southwest southwestair brd frustrat buf roc tld flt gng held earlier would mess cng unabl due overbk,negative
1750,airway usairway flight clt bos,neutral
1751,delta jetblu great thank great flight fyi excit fli frustrat abl check,neutral
1752,southwest southwestair sweet glad hear keep guy mind next time,positive
1753,delta jetblu fleet fleek,neutral
1754,unit unit frontier current offer weather except weekend unit,neutral
1755,delta jetblu take round trip ticket closest warmest place pleas negativedegre buffalo snowwillnevermelt,neutral
1756,american americanair possibl call system refus caller twelv hour servic option leav,negative
1757,delta jetblu client ask kid need email address get acct true,neutral
1758,airway usairway best airway follow back pleas ________________________________________,positive
1759,airway usairway americanair need move reserv due weather middl part would like chang depart airport,neutral
1760,unit unit rikrik__ made come help anyth inconvi,negative
1761,virgin america virginamerica wish afford fli next friday go back home love everyth airlin,positive
1762,unit unit yes luckili,neutral
1763,unit unit agent servic weekend trip amaz thank,positive
1764,unit unit hour wait issu resolv contact custom servic comment wait time thank contact,positive
1765,southwest southwestair nice trip back home looong vaca ___,positive
1766,southwest southwestair need updat flight amp hold hour,negative
1767,american americanair wheel exact send,neutral
1768,unit unit brother luggag lost copa airlin flight compet sunday panamerican cross countri cup pleas help,negative
1769,unit unit request upgrad ewr bom flight end may mile copay know upgrad,neutral
1770,southwest southwestair flight bwi isp readi thank keep warm frigidfriday,positive
1771,american americanair yes io run io,neutral
1772,airway usairway guy luggag san jose suppos deliv hotel hour ago pleas contact,negative
1773,american americanair charact respond via formal letter trust plenti say,neutral
1774,southwest southwestair thank got put flight tomorrow much faith get ground tomorrow though,positive
1775,unit unit person current bettween gate lax,neutral
1776,unit unit annricord januari,neutral
1777,delta jetblu claim custom protect notifi custom delay cancel flightlat divers nottru,negative
1778,delta jetblu learn awesom twitter manag today social media market class keep good work sxu phd_mama_,positive
1779,unit unit done thank,positive
1780,delta stop mad jetblu fleet fleek,negative
1781,airway usairway kudo phone support charlott gate staff,positive
1782,southwest southwestair would love tix velour show enter everi contest still,neutral
1783,southwest southwestair pleasant surpris board flight time morn fly_nashvill good job,positive
1784,american americanair apolog requir made home safe thank kudo,positive
1785,unit unit thank took care call,positive
1786,virgin america virginamerica channel year,neutral
1787,american americanair gerri_elliott everi chanc get thank keep exec platinum,positive
1788,southwest southwestair still offer discount seat children would rather put seat lap,neutral
1789,american americanair june thru decemb bus first milesaav award avail cun nyc explain whyfli,neutral
1790,unit biz day calendar respond inquiri unit hope standard univers adopt badcustomerservic,negative
1791,southwest southwestair best video seen ever teamspirit,positive
1792,american americanair flight still sit dfw wait baggag load,negative
1793,southwest southwestair anyon help upgrad buis select cant seem get hail right area know guy good,positive
1794,delta jetblu plane hope longer merci playlist thank,positive
1795,airway usairway thank dont understand feedback,neutral
1796,american americanair eleonora good luck wait week,negative
1797,unit unit sfo dfw also sfo ord,neutral
1798,delta jetblu huge favor,neutral
1799,southwest southwestair aww thank love,positive
1800,unit unit pls hold cnx pax frm runner min hold save fam frm miscnx pls twitter watch,neutral
1801,airway usairway polici around bring breast pump board,neutral
1802,southwest southwestair guest need chang flight reserv need happen say pleas help,neutral
1803,unit unit rebook line peopl deep,negative
1804,southwest southwestair fortunemagazin friendliest employe,positive
1805,unit unit go outbound flight last thur delay hrs long delay worstunitedflightsev,negative
1806,southwest southwestair chantilli pari franc,neutral
1807,airway usairway even accommod let fli anoth airport horribl servic fault,neutral
1808,delta jetblu book work ad upgrad seat need upgrad receipt,positive
1809,southwest southwestair roundtrip ticket need chang one leg trip nearbi airport possibl via websit,neutral
1810,southwest southwestair possibl chanc swa bring back servic lga bwi would make much easier connect west coast,neutral
1811,southwest southwestair yes pleas,positive
1812,unit unit lga ord get agent name argument baggag polici,negative
1813,american americanair origin destin date go airway connect flight direct flight award saver level,neutral
1814,delta jetblu brandssayingba well,positive
1815,southwest southwestair awesom librari,positive
1816,american americanair liar precipit day degre pacifi look like fool that problem admit suck,negative
1817,american americanair kind airlin guy run peopl got line first receiv hotel voucher terribl custom servic,negative
1818,delta jetblu flight njb jblu arriv flytpa follow flight westchest counti airport,neutral
1819,delta jetblu thank anyway southwestair back awesom rate amp amaz custom servic nomoreaggrav,neutral
1820,unit unit amaz fli mile unitedairlin amp allianc last year still got jilt status moneyelsewher,positive
1821,unit unit honest stop tri report thing via websit laugh flight work mile accru sure cosmet,positive
1822,southwest know southwestair,neutral
1823,airway usairway flt hrs late flight baggag see deliv suitcas wet insid amp nothappi,negative
1824,delta jetblu realli accept inform plane start charter bus take passeng jfk,negative
1825,american americanair tri switch flight current monday morn help,neutral
1826,unit unit look email chain one,neutral
1827,virgin america virginamerica first time fli tonight,positive
1828,unit unit peopl counter help see nobodi flight austin still sit,negative
1829,southwest southwestair thank time,positive
1830,delta jetblu thank alicia exceptionalservic,positive
1831,delta jetblu thank remind older flight taken easi access add point new account awesom servic,positive
1832,american americanair ignor,negative
1833,american americanair usairway next stop custom servic,negative
1834,unit unit zero concept custom servic connect delay,negative
1835,american americanair love travel plane peopl nice amaz pleas follow back love compani,positive
1836,airway usairway thank refund bag fee look forward return today hope,positive
1837,airway usairway fix asap,negative
1838,unit unit southwest mechan problem least gave round trip voucher step plate flight,neutral
1839,unit unit great thank,positive
1840,unit unit ethiopia adopt child need flight home add grr late flight earli need chang exist reserv,neutral
1841,southwest southwestair guy stop servic denver horribl get stuck everi time almost hrs,negative
1842,southwest southwestair love guy take airlin week make love appreci much onlywaytofli,positive
1843,unit unit thnx,positive
1844,southwest southwestair flight empti rude,neutral
1845,american americanair happen combin top chef amp beauti san miguel allend late flightst food blog,neutral
1846,delta jetblu guy get rid hip hop station sirius,neutral
1847,unit unit oper unit heathrow newark flight,neutral
1848,southwest southwestair text flight denver tmrw cancel flightl hold hour tri get help flight,negative
1849,american americanair done,neutral
1850,american americanair miami rio particip rcm_ofici repres cisnerosmedia yourstoryher,neutral
1851,delta jetblu thank still book trip slc see grand kid frustrat tri app web etc still love guy,positive
1852,american americanair bad rep loos costum luggag stop fli back,negative
1853,unit unit airlin alway told open cabin door close plane done time tonight,neutral
1854,southwest southwestair nashvill drive half hour memphi made plane load,negative
1855,american americanair despit chao still grate flight home,positive
1856,delta jetblu chang true blue point get phone,negative
1857,airway usairway one clt know runway issu inbound flight one delay connect left without stuck,negative
1858,southwest southwestair sister famili drive mile accommod rebook time manner horribl,negative
1859,southwest southwestair wow thing better forgotten,neutral
1860,virgin america virginamerica got newark home folk ewr incred letsgohom,positive
1861,delta jetblu fleet fleek,neutral
1862,southwest southwestair sent additon info,neutral
1863,unit unit costum servic denver intl airport ridicul bad,negative
1864,delta jetblu word thank,positive
1865,airway usairway travel question could pleas follow,neutral
1866,unit unit help take without miss galley cart one find pax seat last hour,negative
1867,unit unit took exact aircraft lax day ago fit problem agent today told nonsens polici chang,negative
1868,american americanair amen,neutral
1869,southwest southwestair wish would seen hour ago want see tonight bad cri,positive
1870,southwest southwestair murraysawchuck,neutral
1871,unit unit help done,negative
1872,unit unit flight strand tarmac chicago gate avail plane get hot uncomfort,negative
1873,unit unit thank catch conect,positive
1874,southwest southwestair respond specialolymp athlet notcool southwest,negative
1875,unit unit final made rep solv problem,positive
1876,southwest southwestair wifi stink mad hate got money refund,negative
1877,unit unit thank help,positive
1878,unit unit flight appear appli mileageplus account help,neutral
1879,southwest southwestair awwweesssooome,positive
1880,virgin america virginamerica fli love austin excel news,positive
1881,unit unit disgust unconscion treatment receiv tonight,negative
1882,unit unit one great airlin,positive
1883,unit unit realli tri today,negative
1884,airway usairway travel agenc said usairway accept refund money dont understand dont refund,negative
1885,southwest southwestair pleas tell today flight chicago dia cancel flightl thank,neutral
1886,unit unit want make day friend premier amp soon chanc upgrad two leg flight ecom plus,neutral
1887,unit unit uhuh group tri get nashvill iad today instead tomorrow preemptiv though,neutral
1888,american americanair sure thank,positive
1889,southwest southwestair ifthesneverstop still rock chart top hit,neutral
1890,delta jetblu austin,neutral
1891,airway usairway reserv agent phone great job,positive
1892,unit unit begin newark london heathrow rout may panynj boeingairplan froschtravel,neutral
1893,airway usairway thank help left messag dca lost found finger cross find,positive
1894,unit unit mexico intern,neutral
1895,southwest southwestair sinc becom passeng save row seat peopl late flightr board posit rude,negative
1896,american americanair second touchdown madrid airport april avgeek,neutral
1897,southwest southwestair possibl add travel arrang employ upcom travel retriev reserv,neutral
1898,delta jetblu fleet fleek,neutral
1899,delta jetblu well price flight oahu could best friend vincenzolandino,neutral
1900,american americanair dfwairport guy let,positive
1901,unit unit make sure done thank help huge race tri make sure goe smooth peac,positive
1902,airway usairway idea upset frustrat right sure follow never fli,negative
1903,southwest southwestair mine,neutral
1904,american americanair maryella_green receiv actual thank,positive
1905,delta jetblu thank,positive
1906,delta jetblu awesom thank hold,positive
1907,unit unit thank,positive
1908,delta jetblu airlin better system inform client flight cancel flightl last min schedul,negative
1909,unit unit make sure flight delay due poor mainten would start,negative
1910,delta jetblu flight delay still take time amp greet seat yes gum amp garbag,negative
1911,airway usairway good news got fix,positive
1912,unit unit follow pleas airlin beautiful,positive
1913,southwest southwestair thank,positive
1914,delta jetblu handl xjare question like social media pros good practic transport system run friend ai,positive
1915,american americanair attend correct complaint via twitter whoa brave new world live thank american air,positive
1916,unit unit nope even better seat due amp first rais hand got move fast enough,positive
1917,airway usairway exchang credit polici worthless shadier white hous dissatisfi nine right,negative
1918,unit unit yes paper voucher got januari,neutral
1919,delta jetblu still best,positive
1920,unit unit status flight bogot houston,neutral
1921,virgin america virginamerica wow blew mind,positive
1922,southwest southwestair thx op agt rich westagard flight att nanci den airport held flight even save seat bus select customersfirst,positive
1923,southwest southwestair especi mom ichangedyourdiap,neutral
1924,airway usairway flight morn flight thursday monday turn tuesday,negative
1925,airway usairway look fli rock time bird plane nah never mind rock,positive
1926,unit unit thank someth special,positive
1927,american americanair need help cancel flight upcom flight made aadvantag mile record locat hfjkto someon pleas assist,neutral
1928,unit unit lindsay darn terribl memori part know head back iad pit tonight,neutral
1929,american americanair unit need ticket number sinc rebook gave incorrect ticket number check help,negative
1930,airway usairway list baggag claim number call number ticket use ladi speed stick morn,negative
1931,unit unit delay flight mechan failur hrs runway amp hrs late flightr still lost bag amp resolut,negative
1932,unit unit log view reserv tri view specif reserv amp take back login page,negative
1933,delta jetblu tell day fli direct buf fll fll buf,neutral
1934,southwest southwestair heavenlychc least enjoy free cocktail two,positive
1935,american americanair british_airway week ago today arriv miami still bag absolut disgrac,negative
1936,virgin america virginamerica websit,negative
1937,unit unit thank appreci prompt respons passeng,neutral
1938,american americanair sure certain chilli back east today,neutral
1939,airway grace god made usairway __rwg__ power hope make flight,positive
1940,unit unit boe star allianc short final heathrowairport amaz winter morn avgeek,positive
1941,delta jetblu thank,positive
1942,american americanair status flight sju,neutral
1943,delta jetblu airway continu various commerci relationship lufthansa capa_avi,neutral
1944,virgin america virginamerica moodlight way fli best experi ever cool calm moodlitmonday,positive
1945,unit unit cheertymedad gee like almost care ppl think int trust adult daughter,neutral
1946,american americanair thank charg anyth end good,positive
1947,unit unit thank,positive
1948,delta reliev fli jetblu listen everyon neighbor gate bitch spirit airlin better,positive
1949,unit unit fli southwestair never issu,positive
1950,airway usairway decid good sport give guy anoth shot flight delay,negative
1951,virgin america virginamerica great well deserv,positive
1952,unit unit bad anoth unforese oper issu return flight,negative
1953,american americanair yesterday phone,neutral
1954,southwest southwestair thank get paradis safe,positive
1955,american americanair alway enjoy time plane dfw,positive
1956,southwest southwestair site gmail facebook etc,neutral
1957,delta wow jetblu fleet fleek,neutral
1958,unit unit saturday morn man die ebola,neutral
1959,american americanair awesom thank,positive
1960,american americanair mind fee told chang name ticket,negative
1961,delta jetblu spent winter nni mom jetblu take home via bos mon miss hubbi kitti warm countingdown,neutral
1962,southwest southwestair app error say click click hyperlink,negative
1963,american americanair lot plate flight deal cancel flightlat weather tonit import know respond,positive
1964,southwest southwestair thank take notch leinenkugel craftbeer goodflight norfolk_,positive
1965,southwest southwestair thank guy best,positive
1966,airway usairway vega babi good time vega lol,neutral
1967,unit unit phone number custom servic question,neutral
1968,virgin america virginamerica understand help thx comp,positive
1969,southwest southwestair let,negative
1970,delta jetblu acc phone iphon broke would rather chang late flightr,neutral
1971,southwest southwestair accept appl passbook app board pass app work iphon amp ipodtouch ipad,neutral
1972,unit unit kurt crew amaz today made son birthday kind hope fli soon,positive
1973,unit unit thank quick respons cannot follow well,neutral
1974,airway great manag usairway twitter account thank,positive
1975,delta jetblu look cool,positive
1976,unit unit nope case either time,neutral
1977,unit unit flight sime rudest flight attend run drink card flashlight drop noapolog,negative
1978,airway usairway flight nuw arriv flytpa follow flight phlairport,neutral
1979,unit unit wanna grand staff,positive
1980,southwest southwestair love alway get best deal,positive
1981,unit unit frustrat delay happen either gate even onboard aircraft head advanc,negative
1982,southwest southwestair thank,positive
1983,airway usairway custom servic depart intent ignor email queri badservic usairway,negative
1984,southwest southwestair fsve correct attend error gave attitud made rude show take back nut amp said well late flight,negative
1985,unit unit renoairport direct flight houston reno begin see day march,neutral
1986,american americanair care could someon call explain go,negative
1987,unit unit custom servic,negative
1988,southwest southwestair thank great custom servic far accid happen understand hope everyth work,positive
1989,unit unit airlin abus expens video equip overcharg privileg via robthecameraman,negative
1990,unit unit premium upgrad paid amp mileag upgrad done prem eco upgrad fare refund,neutral
1991,delta jetblu appli job pdw could follow realli love job ilovejetblu,neutral
1992,virgin america virginamerica troubl ad flight wife book elev account help,negative
1993,virgin america virginamerica know suicid second lead caus death among teen,neutral
1994,airway usairway holdup look anoth flight,negative
1995,american americanair thank info number call speak person go take hour type,neutral
1996,unit unit chang airport actual get flight flight fay cancel flightl twice taxi ride rdu reimburs,negative
1997,southwest southwestair kid mission trip lasall strand orlando area get back bos pvd till wednesday,neutral
1998,unit unit chang entir flight plan vacat alon day night earli nowher stay help,negative
1999,american americanair disgust chicken entre ever seen standard serious nosediv newamerican,negative
2000,airway usairway last time use airlin promis,negative
2001,virgin america virginamerica group got cancel flightlat fee waiv ticket book rep help either,negative
2002,delta jetblu current check bag price polici fli come week find anyth definit,neutral
2003,unit unit gate definit full park wheel chock custom servic call unmet arriv,negative
2004,american americanair point need tell passeng go jfk wait get flight mess,negative
2005,delta jetblu oki doke know fix,positive
2006,southwest southwestair look forward fli swa friday luv airlin dtw mdw tus,positive
2007,unit unit sorri cold chicago see mean take minut prioriti bag show carousel,negative
2008,unit unit solv final pick second time call thank respons dull work,positive
2009,airway usairway add ktn exist reserv,neutral
2010,southwest southwestair kudo rep patricia gate sunday morn chicago midway mdw,neutral
2011,unit unit serious wait hour plane flight leav leav plane great great,negative
2012,unit unit lost loyal custom mileag plus card holder could driven florida quicker way worst trip ever,negative
2013,delta jetblu min respons time impress offici trueblu jetblu get social,positive
2014,unit unit flight lax iad back row clean prior board gross find use tissu seat pleas,negative
2015,delta like baejet airway amirit jetblu terrybrokebad right back,neutral
2016,unit unit knew flew virginamerica lol,negative
2017,airway usairway cool sweetingr told rout bag told leav last night need race,negative
2018,airway usairway idea thank,neutral
2019,virgin america virginamerica wonder guy reciev abl potenti respond asap,neutral
2020,airway usairway site show time flightawar site show delay tri decid get ice catch flt phx,negative
2021,unit unit partner book individu reserv flight silver share premier privileg somehow,neutral
2022,delta jetblu wear truebluecolor,positive
2023,airway usairway link broken onlin baggag locat alreadi tri gave use inform,negative
2024,american americanair thank get back find airlin futur,negative
2025,airway usairway pleas help find luggag sinc one lost custom servic suck,negative
2026,southwest southwestair hold hrs got cutoff cancel flightl flight get book cruis florida terribl custom servic,negative
2027,delta jetblu celebr year anniversari new liveri digit journal,neutral
2028,american americanair thank good back safe see soon,positive
2029,unit unit guy made day treat well thank,positive
2030,virgin america virginamerica ladygaga carrieunderwood great carrieunderwood,neutral
2031,delta jetblu sinc angri tweet airlin appar read mind could bitch thank credit,positive
2032,delta jetblu okay thank check,positive
2033,airway usairway never travel insan storm inevit make hold add lap child badservic,negative
2034,american americanair yes,neutral
2035,american americanair tri alreadi wait list call back hourwaitsuck,negative
2036,american americanair cost day vacat got rude woman tell anoth countri figur get,negative
2037,airway usairway thank busi time,positive
2038,unit unit compens delay caus fact enough flight attend,negative
2039,american americanair help,negative
2040,virgin america virginamerica thank take care suuperg flight rockstar travel,positive
2041,airway usairway late flightr flight charleston leav flight schedul earlier wrong,negative
2042,unit unit look like came thank help,positive
2043,unit unit thank listen compliant right thing appreci work,positive
2044,unit unit found flight airfarewatchdog,neutral
