id,tweet,class
680,unit unit abl send good,positive
681,southwest southwestair hot stewardess flip,positive
682,american americanair lost basket ballbag plane,negative
683,southwest southwestair wish allow access site award track,neutral
684,unit unit chanc flight delay nervous drive dfw weather drop brother,neutral
685,southwest southwestair rndtrp djq_kc djimpact tri make travel reserv vega may late flight,neutral
686,airway usairway wrongansw talk cheap custom servic action make thing right custom fail,negative
687,southwest southwestair twitter say someon unless follow southwestair follow twitter thank,negative
688,american americanair mail adress send ceo doug parker letter hope read,neutral
689,virgin america virginamerica airlin awesom lax loft need step game dirti tabl floor,negative
690,airway usairway good understand terminolog merger bring new verbiag,neutral
691,unit unit delay due custom servic mean,negative
692,american americanair thank,positive
693,unit unit hotel peopl feel like held hostag someon board pass leav fail,negative
694,southwest southwestair thank yall expect oper tomorrow nashvill,positive
695,american americanair airport extra night hotel heard anyth embarrass airlin say,negative
696,delta jetblu thank sent msg,positive
697,airway usairway worri flight attend took care,positive
698,southwest southwestair thank,positive
699,american americanair said work time dfw secur entranc pre check wherea paid servic,neutral
700,airway usairway alright pleas give scott bdl bonus excel custom servic,positive
701,unit unit sent lack custom servic get ridicul,negative
702,delta jetblu dmed thank much address quick,positive
703,airway usairway time today phl nice work thereisafirstforeveryth,positive
704,unit unit reebok rockinwel denver intern airport,positive
705,southwest southwestair fortunemagazin love forever_____,positive
706,unit unit lost voucher given miami aeroport jan use,neutral
707,american americanair watch parent break stroller amp tell look fine print,negative
708,virgin america virginamerica add dtw sold,neutral
709,airway usairway good luck get cool,neutral
710,american americanair way,neutral
711,unit unit sure call custom care custom care,negative
712,american americanair custom servic suck rep yell caller regard weather dfw hope bankrupt,negative
713,american americanair want stay overnight airport sinc morn,negative
714,airway usairway know suicid second lead caus death among teen,neutral
715,southwest southwestair tomvh get credit card get point famili way,neutral
716,american americanair kid think done call dozen time amp tell call back amp hang,negative
717,unit unit follow,neutral
718,american americanair need refund,negative
719,virgin america virginamerica thank,positive
720,southwest southwestair jump gun littl cancel flight flight airlin cancel flight louisvill ruin vacat,negative
721,southwest southwestair scaveng hunt boston,neutral
722,delta jetblu thank great recap abl sleep nervous bad guy get away,positive
723,southwest southwestair pleas last ticket best friend destinationdragon,neutral
724,american americanair need yyz tmr morn switch unit alreadi bag still land,negative
725,airway usairway hmmm flight even realli exist creat last night get peopl back usairsuck,negative
726,southwest southwestair would love win ticket take son imagin dragon provo saturday night cross finger destinationdragon,neutral
727,southwest southwestair hold southwest hour automat hang iusedtoloveu,negative
728,virgin america virginamerica anoth perfect flight come plane sun visor stay carrier make rais,positive
729,delta jetblu disappoint lack compass baggag servic dept near beg get courtesi report,negative
730,southwest southwestair thank quick respons call daili wait day,positive
731,virgin america virginamerica ssal thank,positive
732,airway usairway shoutout kristi gate pvd today rockstar tremend help tough situat promotethatgirl,positive
733,unit unit pls help babi hannah get life save surgeri requir need help pls donat,neutral
734,unit unit tri charg buck lower award ticket want get hard earn point back total,negative
735,southwest southwestair passngr requir wheelchair plane sit exit row wld physic capabl help emerg,neutral
736,airway usairway hey let know worst fuck servic ever use thank noth,negative
737,unit unit told wrong carousel number,neutral
738,unit unit child birthdat full name,neutral
739,southwest southwestair follow,neutral
740,delta jetblu seem friend speak high well need find decent price way yvr sea overnight,positive
741,american americanair yes issu site well unfortun,negative
742,southwest southwestair could mayb hook fuyukaidesuyo imagin dragon ticket tonight shes hugeeee fan amp would realli love,neutral
743,unit unit thank keep good work,positive
744,delta jetblu ceo pilot among ardent fan wall street poughkeepsi journal,neutral
745,southwest southwestair hold almost hour luv imjustsay ___,negative
746,unit unit decept market practic promis book flight would retain status grant neverflyunit,negative
747,unit unit understand tri flight book problem sever time passeng amp got messag mention agent price,neutral
748,american americanair necessari confid excel flight staff make appropri report,positive
749,southwest southwestair thank thank thank last attempt win destinationdragon ticket success could happier,positive
750,unit unit either fine howev plunder hard earn dollar fine,negative
751,delta jetblu thank much effort,positive
752,american americanair thank,positive
753,unit unit thank prompt respons anoth hour enjoy vacat perhap bug app still show,positive
754,unit unit pleas premier platinum,positive
755,southwest southwestair yrs amp live tulsa swa alway take see love southwestluvsweep,positive
756,unit unit ntrustopen golfunit,neutral
757,airway usairway black hole phone system,negative
758,delta jetblu dump amex nassau news live,neutral
759,unit unit delay unit gate agent borderlin rude ask flight status question happen unit,negative
760,delta jetblu fleet fleek lmaoooo ____,neutral
761,delta jetblu call well hook,neutral
762,southwest southwestair flight continu vega stop upset stowaway,neutral
763,airway usairway fun,positive
764,airway usairway americanair someon help travel issu today,neutral
765,unit unit receiv bag appreci take care matter follow,positive
766,unit unit far worst airlin ever,negative
767,american americanair wait time hour talk exec plt agent go,negative
768,american americanair great job great servic sdf weekend winter storm,positive
769,unit unit thank,neutral
770,southwest southwestair yes much look forward use airlin futur flight never,negative
771,american americanair check des moin lay ord final destin austin texa baggag check ord,negative
772,southwest southwestair custom servic terribl terribl thought know,negative
773,american americanair go speak custom servic airport tomorrow morn see option need flight tomorrow,neutral
774,unit unit land chicago saw alreadi airborn,neutral
775,virgin america virginamerica mobil site broken show header elevateus numofpointsavail number point let checkin,negative
776,airway usairway worst custom servic ever,negative
777,airway usairway bag polici say stroller car seat need bring car seat stroller call detail,neutral
778,unit unit link messag repli thparti itproblem,neutral
779,airway usairway told return call human,negative
780,american americanair advis gas pilot flight bad one took action,negative
781,airway usairway keep miss updat connect need make jax friend wed strandedattheairport,negative
782,airway usairway thank,positive
783,airway usairway melinda reserv greensboro absolut jewel thank amaz,positive
784,american americanair went check flight advanc husband seat separ flight happen,negative
785,american americanair hour still bag could flown costa rica back gift famili bag,neutral
786,airway usairway truli dissapoint flight delay go miss connect expect rebook flight,negative
787,american americanair thank email long expect respons,positive
788,southwest southwestair flight hour long one best flight ever kudo flight crew airlin general,positive
789,delta jetblu amybruni directtv cours bestdress bluecarpet,positive
790,virgin america virginamerica sign bonus enrol elev,neutral
791,unit unit ticket refund purchas brother fli could use refund credit fli respond,neutral
792,delta jetblu also way get print one record keep whenev fli,neutral
793,southwest southwestair southwest still best airlin around hate baggag room run check bag headphon,positive
794,airway usairway call volum high best answer hang,negative
795,southwest southwestair flight nsw depart mco enrout indianapoli intern airport,neutral
796,southwest southwestair thank see next wednesday fll save peanut,positive
797,airway usairway,positive
798,southwest southwestair would brighter star combin red carpet tonight,positive
799,southwest southwestair guy awesom dontchangeath luv,positive
800,delta jetblu hour delay hour increment realli amp mosaic still pay use loung wast sunday,negative
801,american americanair lax amp got phone reserv everi flight get bos tmrw appar unavail,neutral
802,southwest southwestair sure fhkte schedul leav weekend need push octob,neutral
803,unit unit lose luggag hotelstonight lose reserv hour travel day want get startingbloc,negative
804,unit unit diverg burlington vermont suck,negative
805,unit unit usual issu express sfo posit note mainlin enjoy,negative
806,unit unit pricey chase mileag plus,neutral
807,american americanair reflight book problem follow day unaccept dming phone number,negative
808,delta jetblu tsa jetblu never disappoint,positive
809,unit unit sure happen msp yesterday unhappi bag delay sat msp hrs deliveri,negative
810,american americanair cancel flightl flight fresno rebook lax flight cancel flightl midnight hotel avail,negative
811,delta jetblu appli new tag left bag ground rather load convey belt walk back yard,negative
812,airway usairway complet wast day trip work turn sit plane day ridicul,negative
813,unit unit thousand fan jedediahbila ask give utmost effort get safe flight baggag soon,neutral
814,delta jetblu excel guy best,positive
815,unit unit done done,neutral
816,american americanair tri track back two attende help,neutral
817,southwest southwestair opal dragon book dragon ali woven murder way philippin australia,neutral
818,virgin america virginamerica morn question regard elev point amp flight,neutral
819,american americanair show plane,neutral
820,unit unit surpris last year noth year happen soft land polici level,neutral
821,american americanair got back eventu rollercoast got airport amp got speak someon thing got fix quick,positive
822,unit unit big thank winston assist phone baggag claim issu today realli went extra mile,positive
823,southwest southwestair imaginedragon destinationdragon tix spare wanna see show friday friend hayleymad,neutral
824,southwest southwestair ceo kelli draw record crowd bwi_airport busi partnership breakfast,neutral
825,unit unit wifi work onboard alert attend socket sent hotel hour voucher wifi hotel,negative
826,delta jetblu tri love custom servic thank,positive
827,unit unit appreci immedi offer suspect long term issu simpl fix also ski bootbag polici awkward best,negative
828,unit unit thank explan seem like odd incent structur tho dramat diminish valu cert,positive
829,delta jetblu ask heavi gun know iwoulddoanythingforlov brandmanc lovesongfriday,neutral
830,delta jetblu back haiti deliv shoe book amp medicin kid met orphanag last year flyingitforward,neutral
831,delta jetblu probabl find ticket,negative
832,unit unit thank,positive
833,delta yasssss fuccc jetblu fleet fleek,neutral
834,southwest southwestair rescu sundown chicago next stop san antonio,neutral
835,american americanair flight time late flight though,positive
836,unit unit get name dalla flight chicago,neutral
837,unit unit den phx flight tomorrow cancel flight ask overnight nite lax sna told without pay wrong,negative
838,unit unit bag final deliv intact thank assist,positive
839,airway usairway despit mechan issu mani delay follow cancel flightlat still get vega thank great gate agent,positive
840,delta jetblu thank next weekend though guess higher,neutral
841,southwest southwestair commit okay pleas hook destinationdragon,neutral
842,delta block bike jetblu fleet fleek,neutral
843,american americanair bdindalla person touch known cool perk blame understaf weather hold time,negative
844,virgin america virginamerica thank great custom servic today amp help get travel sort,positive
845,delta jetblu want custom long beach airport futur intern flight ericbradleypt briansum,neutral
846,unit unit need chang flight tuesday sooner attend ail parent need help custserv,neutral
847,southwest southwestair think flight suppos houston well case someon could check,neutral
848,southwest southwestair want southwest know think great use anymor noth look,negative
849,american americanair south snow atl,neutral
850,american americanair know control weather control treat custom shaft,negative
851,delta jetblu fleet fleek,neutral
852,delta jetblu good know thank much,positive
853,unit unit mile earn explor card count toward lifetim mile,neutral
854,american americanair sensit fact believ warrant poor servic littl help amp compass goe long way,negative
855,virgin america virginamerica flight vega boston today check onlin bag count regist fix somehow,negative
856,unit unit great custom servic thank,positive
857,american americanair nicest peopl ever flight chicago thank david dean amp norma sedholm make feel comfort,positive
858,airway usairway americanair flight four subsequ delay destroy travel plan even look resolv matter,negative
859,airway usairway glad spend hour tri track basic inform alreadi avail,negative
860,delta jetblu chair could use tlc power outlet area would bonus head universalorl,positive
861,delta jetblu short stop jfk iad,neutral
862,southwest southwestair thank,neutral
863,unit unit servic staff great usual cleanli smell bit much back satisfi travel,positive
864,delta ninadavuluri think treat onboard enjoy flight,positive
865,unit unit broken light min get bridg gate airplan park wrong bathroom empti last night airlin last hrs,negative
866,delta jetblu hate internet lol,neutral
867,southwest southwestair jlittl doubl comment phl anywher south florida gone gone gone hello air,negative
868,airway usairway know deal weather phlairport hot mess pls send reinforc,negative
869,unit unit stuck airport hour standbi cuz pilot show late flight pjs amp miss connectin flight tell nyfw,negative
870,unit unit see hour thank,neutral
871,delta jetblu great thank let hope could pleas notifi flight leav jfk thank,positive
872,airway usairway go plan understat flight chang famili emerg cancel flight,negative
873,american americanair tomorrow site show flight ewr cancel flightl,negative
874,delta jetblu mosiac,neutral
875,southwest southwestair way know check bag curb awesom want sure get high five,positive
876,southwest southwestair honest expect fast respons thank chiberia,positive
877,airway usairway thank hour layov too_ ice cake least staff courteous help unreal,positive
878,unit unit would great,positive
879,virgin america virginamerica pair includ red wine white offer redwineisbett,negative
880,delta jetblu custom servic ment anyth would tri quot polici never effect custom servic,negative
881,delta jetblu thank alway amaz custom servic bring disney princess half marathon,positive
882,airway usairway thx gate agt john pascucci find flight clt pvd origin one cancel flightl,positive
883,american americanair hold almost hour ridicul,negative
884,southwest southwestair honesti alway polici,neutral
885,american americanair yes yes yes glad head home,positive
886,american americanair thank look forward respons,positive
887,unit unit guy awesom thank,positive
888,american americanair love new plane jfk lax run mayb one day one amen function nocharg ever,positive
889,unit unit chase say referr bonus thank,neutral
890,southwest southwestair done,neutral
891,airway usairway provid poor custom servic respond complaint copi past templat flight unrel flightd complaint usairwaysfail,negative
892,unit unit grandma ella would love birthday greet flight crew stewardess eastern airlin,neutral
893,delta jetblu thank guy awesom,positive
894,airway usairway rude arrog gate personnel uncal unprofession theworst,negative
895,southwest southwestair lol alreadi card member well lol enjoy fli guy,positive
896,american americanair thank help guy best americanairlin americanair,positive
897,unit unit prioriti iov,positive
898,american americanair one question wife get bonus call today,neutral
899,delta jetblu weepysweetmonti heard your plan let peopl fli overhead compart would,neutral
900,airway usairway jdbwaffl excit fli spring break,positive
901,delta jetblu ccndjp send screen shot system error email address provid,negative
902,delta jetblu lgb sunni cal,neutral
903,unit unit power outlet seat hour flight california serious airlin fail pathet,negative
904,southwest southwestair want bad know mail help wmnlife hotmail com,neutral
905,airway usairway hour minut hold count thank help customerservic brutal,negative
906,unit unit flt delay mainten fix board flight crew stay board area fail,negative
907,delta jetblu websit access flight info,negative
908,southwest southwestair quick question let say book flight drop price get cheaper rate,neutral
909,airway usairway star align connect flight delay clt made thank glad know someon listen time mobay,positive
910,american americanair spent choppiest feed whiplash ever americanairlinesfail iwantmymoneyback,negative
911,american americanair umm unexpect unexpect mean guy know major staff shortag,negative
912,virgin america virginamerica thank much awesom support guy rock,positive
913,southwest southwestair glassdoor best place work snag overal notsurpris luvthem,neutral
914,unit unit kid send stuff thank,neutral
915,american americanair hour answer call,neutral
916,virgin america virginamerica battl southwestair dallaslovefield austinairport rout via usatoday,neutral
917,delta jetblu screw last time southwestair glad give busi jetscrew awfulcustomerservic,negative
918,delta jetblu thank,positive
919,unit unit thank unit understand would actual like bag back done also want money,negative
920,unit unit thank sign notif shall watch wait,neutral
921,southwest southwestair take electr skateboard domest flight polici list site regular board appli,neutral
922,airway usairway happen locat,negative
923,southwest southwestair southwest airlin way,positive
924,southwest southwestair wait thank respons,positive
925,airway usairway thank,positive
926,virgin america virginamerica hot femal pilot sweet dca sfo,positive
927,american americanair motor usual start engin broke cvgairport ground crew fail time per pilot mainten,neutral
928,southwest southwestair apolog accept customerservicewin itravelalot,positive
929,delta jetblu delay cabcel,neutral
930,unit unit play bizarr safeti video ever seen,neutral
931,southwest southwestair lacma fairfax,neutral
932,southwest southwestair receiv birthday card amaz made smile joy nice video thank,positive
933,american americanair koa lax phl ord book way savr awrd call chnge koa lax phx ord would pay fee,neutral
934,unit unit nope set thx check,positive
935,virgin america virginamerica ipad iphon click checkin link email receiv hrs flight,neutral
936,unit unit cours inflight crew great,positive
937,airway usairway cakendeath question ladi behav,neutral
938,southwest southwestair thx make right help meagan fouti brancato dfw gate preboard kid group pleas pleas,positive
939,american americanair thank much,neutral
940,virgin america virginamerica fli lax sfo look awesom movi lineup actual wish long haul,positive
941,american americanair would also like say kind move ad point,positive
942,american thank americanair much appreci,positive
943,unit unit round trip,neutral
944,delta jetblu complet wast entir day pathet,negative
945,american americanair free check bag food comp fli credit someth help addit dollar hole,negative
946,virgin america virginamerica make bos las non stop perman anytim soon,neutral
947,delta jetblu definit thank,positive
948,southwest southwestair dmed confirm number,neutral
949,southwest southwestair blow custom servic shotwest airlin,negative
950,delta ___ jetblu fleet fleek,neutral
951,unit unit hour mainten delay enuf charg bag global servic platinum mbr get shit togeth,negative
952,unit unit shes reschedul today frigid cold possibl reason mainten could issu day,negative
953,unit unit well fix miss buddi bday neglig attempt make,negative
954,airway usairway help flight cancel flight call phone work europ pleas help say book want confirm,negative
955,unit unit staff deck cabin sfo bos except today pleas tell well done,positive
956,delta jetblu site thelodg fun day yeniettelswood andrewbiga codyclev heidimacey motherpollock,positive
957,delta jetblu spoken rep allow check bag tsa checkpoint guarante talk someon,negative
958,airway usairway best airway follow pleas ___________________________,positive
959,american americanair return flight schedul wednesday believ thank help,positive
960,american americanair lpalumbo weather sun,negative
961,unit unit crew,neutral
962,southwest southwestair sign,positive
963,airway usairway useless airway day tri get home standbi result cancel flightlat usairway,negative
964,airway usairway strand bwi two divers cust servic transport dump terribl custom servic,negative
965,southwest southwestair black histori commerci realli sweet well done,positive
966,delta aww jetblu guess need book flight somewher warm asap suggest,neutral
967,airway usairway nightmarish custom servic elit member appal,negative
968,airway usairway delay day weather top got yell late flight notifi time chang welldon,negative
969,unit unit leigh_emeri like hear anyth help thank anoth empti offer help,negative
970,delta jetblu thank help,positive
971,virgin america virginamerica thank gate check baggag full flight dfw lax give earli board sweet,positive
972,delta jetblu bag bag full,neutral
973,unit unit illeg breach contract touch custom feedback,negative
974,virgin america virginamerica email custom servic team let know need track number,neutral
975,american americanair thank idk still late flight hope get tonight,positive
976,unit unit jmc noth like support mechan mainten worker instead unit put video timco wifi,negative
977,unit unit cool need work today get home make sure hous wind chill,neutral
978,airway usairway disgust poor custom servic wrong remov mile dividend mile live person,negative
979,unit unit okay thank help appreci time,positive
980,delta jetblu ceo battl appeas passeng wall street thevdt,neutral
981,unit unit cancel flight flight rebook ad flight drive denver thank,neutral
982,airway usairway sure,neutral
983,southwest southwestair thank wait either,positive
984,american americanair usairway statement sent yesterday like jeanin said even call last night well excel servic,positive
985,southwest southwestair thank lindsey amp southwest twitter team great servic amp speedi resolut luvag swa,positive
986,delta jetblu australia enjoy land alway bucket list flyingitforward,neutral
987,virgin america virginamerica atlant plough lone furrow middleeast thenationalua,neutral
988,unit unit refus board nexus nexus confirm refus,negative
989,southwest southwestair thank much make cancel flightlat sent info,positive
990,southwest southwestair got next time know pay extra make line,neutral
991,southwest southwestair thank,positive
992,unit unit rep hung min hold ask supervisor furious right,negative
993,virgin america virginamerica spruce moos,neutral
994,unit unit ord dca,neutral
995,delta jetblu connecticut,neutral
996,southwest southwestair hey southwest help find flight nashvill washington raleigh march pleas,neutral
997,unit unit read full stori submit case team pilot flight sleep dia,negative
998,southwest southwestair what flight myer milwauke,neutral
999,southwest southwestair better defin plus one smaller type item carri requir small backpack,neutral
1000,southwest southwestair love air travel get easier,positive
1001,unit unit today staff msp took custom servic new level father pass away last night amp help get home today thank,positive
1002,unit unit plane come delay almost hour plane,negative
1003,unit unit rush degre weather get airport time bad pilot stillwait,negative
1004,delta jetblu start look flight,neutral
1005,airway usairway probabl lose famili world travel custom due broken process americanair hope fix,negative
1006,american americanair thank good suggest check rebook keep check look flight,positive
1007,american americanair airport snow remov method keep good work folk cessna becom,positive
1008,airway usairway worst fli experi guy need better,negative
1009,american americanair gold elit loyalti custom count hometown prefer airlin right bum,negative
1010,american americanair yep one camera memori card,positive
1011,unit unit flight cancel flight trip refund without difficulti staff extrem help complaint way handl bad weather,positive
1012,american americanair kconti look like jfk great pic oneworld jet line opposit side air berlin lan,neutral
1013,american americanair yes thank found see gray tab first,neutral
1014,american americanair also hold minut custom servic find new flight schedul site suck,negative
1015,american americanair cancel flightl flight without courtesi notifi altern poor,negative
1016,unit unit land anchorag way fairbank,positive
1017,american americanair navi sister flight cancld get agent call back put hold amp discnct help,negative
1018,southwest southwestair made standbi flight cancel flight reason almost hrs late flight conf fvfyw swrr,negative
1019,airway usairway guy general enquir email address pleas thank david,neutral
